state,nces_original_name,gov_unit_original_name,name,ncesid,censusid,student,acfrs_original_name
NJ,Milltown School District,milltown boro sch dist,milltown,3410290,31501201100000,802.00000,NA
NJ,Millville School District,millville city school district,millville,3410320,31500620100000,5323.00000,city of millville board of education
NJ,Mine Hill Township School District,mine hill twp sch dist,mine hill,3410350,31501402000000,340.00000,NA
NJ,Monmouth Beach School District,monmouth beach boro sch dist,monmouth beach,3410380,31501302800000,232.00000,NA
NJ,Monmouth Regional High School,monmouth reg high school dist,monmouth regional,3410440,31501350100000,961.00000,NA
NJ,Montague Township School District,montague twp sch dist,montague,3410530,31501901200000,244.00000,NA
NJ,Montgomery Township School District,montgomery twp sch dist,montgomery,3410590,31501801300000,4701.00000,township of montgomery school district
NJ,Montvale Board of Education School District,montvale boro school dist,montvale board of education,3410620,31500203300000,997.00000,NA
NJ,Moonachie School District,moonachie boro sch dist,moonachie,3410680,31500203400000,347.00000,NA
NJ,Morris Hills Regional School District,morris hills regional dist,morris hills regional,3410740,31501402300000,2778.00000,morris hills regional school district
NJ,Morris Plains School District,morris plains sch dist,morris plains,3410770,31501402400000,600.00000,NA
NJ,Mount Arlington Public School District,mount arlington boro sch dist,mount arlington,3410860,31501402600000,369.00000,NA
NJ,Mount Laurel Township School District,mount laurel twp sch dist,mount laurel,3410950,31500301900000,4259.00000,township of mount laurel school district
NJ,Mount Olive Township School District,mount olive twp sch dist,mount olive,3410980,31501402700000,4692.00000,NA
NJ,Mountain Lakes Public School District,mountain lakes boro sch dist,mountain lakes,3411010,31501402800000,1379.00000,NA
NJ,Mountainside School District,mountainside boro school dist,mountainside,3411040,31502000700000,755.00000,NA
NJ,Mt. Ephraim School District,mt ephraim boro sch dist,mt ephraim,3410890,31500402500000,430.00000,NA
NJ,National Park Boro School District,national park boro school dist,national park,3411100,31500801200000,286.00000,NA
NJ,Neptune City School District,neptune city boro school dist,neptune,3411130,31501302900000,272.00000,NA
NJ,Netcong School District,netcong boro sch dist,netcong,3411190,31501402900000,292.00000,NA
NJ,New Milford Public School District,new milford boro sch dist,new milford,3411280,31500203500000,2008.00000,new milford board of education
NJ,New Providence School District,new providence boro sch dist,new providence,3411310,31502000800000,2439.00000,NA
NJ,Newark Public School District,newark city school system,newark,3411340,31000000030200,41629.00000,newark board of education
NJ,NEWTON PUBLIC SCHOOL DISTRICT,newton town sch dist,newton,3411400,31501901300000,1631.00000,town of newton school district
NJ,Northern Burlington County Regional School District,north burlington county regional high school district,northern burlington county regional,3411700,31500350200000,2193.00000,NA
NJ,North Caldwell School District,north caldwell boro sch dist,north caldwell,3411520,31500700900000,695.00000,NA
NJ,North Haledon School District,north haledon borough school district,north haledon,3411550,31501600500000,624.00000,NA
NJ,North Hunterdon-Voorhees Regional High School District,north hunterdon-voorhees reg sch dist,north hunterdon voorhees regional,3411610,31501002200000,2431.00000,NA
NJ,North Plainfield School District,north plainfield boro school dist,north plainfield,3411640,31501801400000,3456.00000,borough of north plainfield school district
NJ,North Warren Regional School District,north warren reg sch dist,north warren regional,3409550,31502180100000,763.00000,NA
NJ,North Wildwood School District,north wildwood city school dist,north wildwood,3411670,31500590300000,217.00000,NA
NJ,Northern Highlands Regional High School District,northern highlands reg high school dist,northern highlands regional,3411730,31500270100000,1432.00000,NA
NJ,Northern Valley Regional High School District,northern valley reg high school district,northern valley regional,3411760,31500203700000,2156.00000,northern valley regional high school district
NJ,Northfield City School District,northfield city school dist,northfield,3411790,31500190100000,973.00000,city of northfield board of education
NJ,Northvale Public School District,northvale boro sch dist,northvale,3411820,31500203800000,558.00000,NA
NJ,Norwood Public School District,norwood boro sch dist,norwood,3411850,31500203900000,620.00000,NA
NJ,Nutley Public School District,nutley town sch dist,nutley,3411880,31500701000000,4125.00000,nutley board of education
NJ,Oakland Public School District,oakland boro sch dist,oakland,3411910,31500204000000,1360.00000,NA
NJ,Oaklyn Public School District,oaklyn boro sch dist,oaklyn,3411940,31500402600000,282.00000,NA
NJ,Ocean Gate School District,ocean gate boro sch dist,ocean gate,3412030,31501501900000,132.00000,NA
NJ,Oceanport School District,oceanport boro sch dist,oceanport,3412120,31501303200000,600.00000,NA
NJ,OFFICE OF EDUCATION DEPARTMENT OF CHILDREN AND FAMILIES,office of education department of children and families,office of education department of children and families,3400085,31634000850000,393.00000,NA
NJ,OFFICE OF EDUCATION JUVENILE JUSTICE COMMISSION,office of education juvenile justice commission,office of education juvenile justice commission,3400089,31634000890000,157.00000,NA
NJ,OFFICE OF EDUCATIONAL SERVICES DEPARTMENT OF CORRECTIONS,office of educational services department of corrections,office of educational services department of corrections,3400088,31634000880000,132.00000,NA
NJ,Ogdensburg Borough School District,ogdensburg boro sch dist,ogdensburg,3412150,31501901400000,257.00000,NA
NJ,Old Tappan Public School District,old tappan boro sch dist,old tappan,3412180,31500204100000,672.00000,NA
NJ,Oldmans Township School District,oldmans twp sch dist,oldmans,3412210,31501700700000,284.00000,NA
NJ,Oradell Public School District,oradell boro sch dist,oradell,3412240,31500204200000,768.00000,NA
NJ,ORANGE BOARD OF EDUCATION School District,orange city township school district,orange board of education,3412270,31300761530100,5802.00000,NA
NJ,Oxford Township School District,oxford twp sch dist,oxford,3412300,31502101700000,267.00000,NA
NJ,Palisades Park School District,palisades park boro sch dist,palisades park,3412360,31500204300000,1846.00000,palisades park board of education
NJ,Palmyra Public School District,palymra boro sch dist,palmyra,3412390,31500302200000,940.00000,borough of palmyra school district
NJ,Paramus Public School District,paramus boro sch dist,paramus,3412420,31500204400000,3760.00000,paramus board of education
NJ,Park Ridge School District,park ridge boro sch dist,park ridge,3412450,31500204500000,1257.00000,NA
NJ,Pascack Valley Regional High School District,pascack valley reg high school dist,pascack valley regional,3412510,31500204600000,1987.00000,NA
NJ,Passaic City School District,passaic city sch dist,passaic,3412540,31501680100000,14358.00000,passaic board of education-passaic public schools
NJ,Passaic County Manchester Regional High School District,passaic cnty-manchester reg school dist,passaic county manchester regional,3412600,31501650200000,818.00000,NA
NJ,Paulsboro School District,paulsboro boro sch dist,paulsboro,3412720,31500801400000,1229.00000,paulsboro board of education
NJ,Penns Grove-Carneys Point Regional School District,penns grove carneys point reg sch dist,penns grove carneys point regional,3412840,31501700800000,2233.00000,penns grove carneys point regional school district
NJ,Pequannock Township School District,pequannock twp sch dist,pequannock,3412900,31501403200000,2078.00000,NA
NJ,Phillipsburg School District,phillipsburg town school dist,phillipsburg,3412960,31502180200000,3991.00000,phillipsburg school district
NJ,Pine Hill School District,pine hill boro sch dist,pine hill,3412990,31500402800000,1918.00000,borough of pine hill school district
NJ,Pinelands Regional School District,pinelands reg sch dist,pinelands regional,3413000,31501560100000,1564.00000,pinelands regional school distrcit
NJ,Pitman Boro School District,pitman boro sch dist,pitman,3413080,31500801500000,1258.00000,borough of pitman school district
NJ,Pohatcong Township School District,pohatcong twp sch dist,pohatcong,3413260,31502101900000,307.00000,NA
NJ,Point Pleasant Beach School District,point pleasant beach boro sch dist,point pleasant beach,3413320,31501502200000,743.00000,NA
NJ,Pompton Lakes School District,pompton lakes boro school dist,pompton lakes,3413350,31501600700000,1726.00000,borough of pompton lakes board of education
NJ,Port Republic School District,port republic city school district,port re,3413380,31200101530100,111.00000,NA
NJ,Prospect Park Public School District,prospect park boro school dist,prospect park,3413470,31501600800000,878.00000,borough of prospect park board of education
NJ,Quinton Township School District,quinton twp sch dist,quinton,3413500,31501701100000,298.00000,NA
NJ,Ramapo Indian Hills Regional High School District,ramapo-indian hills reg high school dist,ramapo indian hills regional,3413560,31500204700000,2271.00000,NA
NJ,Ramsey School District,ramsey boro sch dist,ramsey,3413590,31500204800000,2711.00000,ramsey board of education
NJ,Rancocas Valley Regional High School District,rancocas valley reg high school dist,rancocas valley regional,3413620,31500302500000,2107.00000,rancocas valley regional high school district
NJ,Readington Township School District,readington twp sch dist,readington,3413710,31501002300000,1486.00000,NA
NJ,Red Bank Borough Public School District,red bank boro sch dist,red bank borough,3413740,31501303400000,1438.00000,NA
NJ,Red Bank Regional School District,red bank regional high sch dist,red bank regional,3413750,31501390100000,1290.00000,NA
NJ,Ridgefield School District,ridgefield boro sch dist,ridgefield,3413770,31500204900000,1462.00000,ridgefield board of education
NJ,Ridgefield Park Public School District,ridgefield park vil school d,ridgefield park,3413800,31500205000000,2234.00000,ridgefield park board of education
NJ,Ringwood School District,ringwood boro sch dist,ringwood,3413860,31501600900000,1097.00000,NA
NJ,River Dell Regional School District,river dell regional high sch dist,river dell regional,3412260,31500250100000,1617.00000,NA
NJ,River Edge School District,river edge boro sch dist,river edge,3413890,31500205200000,1241.00000,NA
NJ,River Vale Public School District,river vale twp sch dist,river vale,3413950,31500205300000,1111.00000,NA
NJ,Riverdale School District,riverdale boro sch dist,riverdale,3413980,31501403400000,324.00000,NA
NJ,Riverton School District,riverton boro sch dist,riverton,3414040,31500302700000,305.00000,NA
NJ,Rochelle Park School District,rochelle park sch dist,rochelle park,3414070,31500205400000,513.00000,NA
NJ,Rockaway Borough School District,rockaway boro sch dist,rockaway,3414100,31501403500000,545.00000,NA
NJ,Roosevelt Borough Public School District,roosevelt boro sch dist,roosevelt borough,3414220,31501303500000,80.00000,NA
NJ,Roseland School District,roseland boro sch dist,roseland,3414250,31500701100000,471.00000,NA
NJ,Roselle Public Schools,roselle boro sch dist,roselle public,3414280,31502000900000,2897.00000,NA
NJ,Roselle Park Public School District,roselle park boro sch dist,roselle park,3414310,31502001000000,2068.00000,school district of roselle park
NJ,Rumson Borough School District,rumson boro sch dist,rumson,3414370,31501303600000,1009.00000,NA
NJ,Rumson-Fair Haven Regional High School District,rumson fair haven reg high school dist,rumson fair haven regional,3414400,31501303700000,1004.00000,NA
NJ,RUNNEMEDE PUBLIC SCHOOL DISTRICT,runnemede boro sch dist,runnemede,3414430,31500403000000,863.00000,NA
NJ,Rutherford School District,rutherford boro sch dist,rutherford,3414460,31500205600000,2652.00000,rutherford school district
NJ,Saddle River School District,saddle river boro sch dist,saddle river,3414520,31500205800000,154.00000,NA
NJ,Salem City School District,salem school district,salem,3414550,31501740100000,1275.00000,city of salem school district
NJ,Sandyston-Walpack Consolidated School District,sandyston-walpack school dist,sandyston walpack consolidated,3414610,31501901500000,119.00000,NA
NJ,Sayreville School District,sayreville boro sch dist,sayreville,3414640,31501201600000,6298.00000,sayreville board of education
NJ,Scotch Plains-Fanwood School District,scotch plains fanwood reg school dist,scotch plains fanwood,3414670,31502001100000,5631.00000,NA
NJ,Sea Girt Borough School District,sea girt sch dist,sea girt,3414730,31501303900000,154.00000,NA
NJ,Seaside Heights School District,seaside heights boro school dist,seaside heights,3414790,31501502300000,210.00000,NA
NJ,Secaucus School District,secaucas town sch dist,secaucus,3414850,31500980200000,2304.00000,secaucus board of education
NJ,Shamong Township School District,shamong twp sch dist,shamong,3414880,31500302800000,732.00000,NA
NJ,Shore Regional High School District,shore regional high school district,shore regional,3414940,31501350300000,660.00000,NA
NJ,Shrewsbury Borough School District,shrewsbury boro sch dist,shrewsbury,3414970,31501304000000,492.00000,NA
NJ,Somerdale School District,somerdale boro sch dist,somerdale,3415000,31500403100000,488.00000,NA
NJ,Somers Point School District,somers point city sch dist,somers point,3415030,31500190200000,867.00000,city of somers point board of education
NJ,Somerset Hills Regional School District,somerset hills school district,somerset hills regional,3400009,31501800300000,1953.00000,NA
NJ,Somerville Public School District,somerville boro sch dist,somerville,3415090,31501801700000,2333.00000,somerville borough school district
NJ,SOUTH BOUND BROOK PUBLIC SCHOOL DISTRICT,south bound brook boro school dist,south bound brook,3415180,31501801800000,435.00000,NA
NJ,South Brunswick School District,south brunswick twp sch dist,south brunswick,3415210,31501201700000,8502.00000,township of south brunswick school district
NJ,South Hackensack School District,south hackensack twp sch dist,south hackensack,3415240,31500205900000,299.00000,NA
NJ,South Harrison Township School District,south harrison twp sch dist,south harrison,3415270,31500801600000,331.00000,NA
NJ,South Hunterdon Regional School District,south hunterdon regional sch dist,south hunterdon regional,3400769,31501050300000,952.00000,NA
NJ,South Orange-Maplewood School District,south orange-maplewood school dist,south orange maplewood,3415330,31500701200000,7353.00000,south orange and maplewood school district board of education
NJ,South Plainfield School District,south plainfield boro school dist,south plainfield,3415360,31501201800000,3400.00000,borough of south plainfield school distrcit
NJ,Southern Regional School District,south regional high sch dist,southern regional,3415480,31501550100000,2905.00000,southern regional school district
NJ,South River Public School District,south river boro sch dist,south river,3415390,31501201900000,2361.00000,south river borough board of education
NJ,Southampton Township School District,southampton twp sch dist,southampton,3415420,31500302900000,704.00000,NA
NJ,Spotswood Public School District,spotswood boro sch dist,spotswood,3415540,31501202000000,1683.00000,NA
NJ,Spring Lake Borough,spring lake boro sch dist,spring lake,3415570,31501304300000,152.00000,NA
NJ,Spring Lake Heights School District,spring lake hght boro sch dist,spring lake heights,3415600,31501304400000,343.00000,NA
NJ,Stanhope School District,stanhope boro sch dist,stanhope,3415720,31501901700000,311.00000,NA
NJ,Sterling Regional School District,sterling high sch dist,sterling regional,3402880,31500450100000,939.00000,NA
NJ,Stillwater Township School District,stillwater twp sch dist,stillwater,3415750,31501901800000,247.00000,NA
NJ,Stone Harbor School District,stone harbor sch dist,stone harbor,3415810,31500500600000,89.00000,NA
NJ,Stow Creek Township School District,stow creek twp sch dist,stow creek,3415840,31500601000000,125.00000,NA
NJ,Stratford School District,stratford boro sch dist,stratford,3415870,31500403200000,895.00000,NA
NJ,Summit Public School District,summit city school district,summit,3415900,31202001230100,4001.00000,NA
NJ,Sussex-Wantage Regional School District,sussex wantage regional school dist,sussex wantage regional,3415960,31501902100000,1049.00000,NA
NJ,Swedesboro-Woolwich School District,swedesboro-woolwich sch dist,swedesboro woolwich,3415990,31500801700000,1583.00000,NA
NJ,Tabernacle Township School District,tabernacle twp sch dist,tabernacle,3416020,31500303100000,670.00000,NA
NJ,Tenafly Public School District,tenafly boro sch dist,tenafly,3416110,31500206100000,3729.00000,tenafly board of education
NJ,Tewksbury Township School District,tewksbury twp sch dist,tewksbury,3416170,31501002500000,514.00000,NA
NJ,Tinton Falls School District,tinton falls sch dist,tinton falls,3416200,31501304100000,1436.00000,school district of the borough of tinton falls
NJ,Totowa Public School District,totowa boro sch dist,totowa,3416260,31501601000000,981.00000,NA
NJ,Tuckerton Borough School District,tuckerton boro sch dist,tuckerton,3416320,31501502700000,329.00000,NA
NJ,Union Beach Public School District,union beach boro sch dist,union beach,3416350,31501304500000,640.00000,NA
NJ,Union City School District,union city school district,union,3416380,31200900930100,13754.00000,city of union city school district
NJ,Union Township School District,union twp sch dist,union,3416440,31501002600000,441.00000,city of union city school district
NJ,Upper Freehold Regional School District,upper freehold reg school dist,upper freehold regional,3416560,31501304600000,2189.00000,NA
NJ,UPPER PITTSGROVE TWP School District,upper pittsgrove twp sch dist,upper pittsgrove twp,3416590,31501701200000,306.00000,NA
NJ,Upper Saddle River School District,upper saddle river sch dist,upper saddle river,3416620,31500206300000,1108.00000,NA
NJ,Ventnor City School District,ventnor city school district,ventnor,3416680,31200101730100,668.00000,city of ventnor school district
NJ,Verona Public School District,verona boro sch dist,verona,3416740,31500701300000,2295.00000,NA
NJ,Vineland Public School District,vineland school district,vineland,3416800,31500640100000,10753.00000,city of vineland board of education
NJ,Waldwick School District,waldwick boro sch dist,waldwick,3416860,31500206400000,1652.00000,NA
NJ,Wallington Boro School District,wallington boro sch dist,wallington,3416920,31500206500000,1289.00000,NA
NJ,Wallkill Valley Regional High School,wallkill valley regional high sch dist,wallkill valley regional,3416870,31501990400000,582.00000,NA
NJ,Wanaque School District,wanaque boro sch dist,wanaque,3416950,31501601100000,906.00000,NA
NJ,Warren Township School District,warren twp sch dist,warren,3416980,31501801900000,1604.00000,NA
NJ,Washington Borough School District,washington boro sch dist,washington,3417010,31502102000000,495.00000,NA
NJ,WATCHUNG BOROUGH SCHOOL DISTRICT,watchung boro sch dist,watchung,3417190,31501802000000,604.00000,NA
NJ,Watchung Hills Regional High School District,watchung hills regional high sch dist,watchung hills regional,3417220,31501802100000,1983.00000,NA
NJ,Waterford Township School District,waterford twp sch dist,waterford,3417250,31500403500000,888.00000,NA
NJ,Wenonah Boro School District,wenonah boro sch dist,wenonah,3417340,31500801900000,168.00000,NA
NJ,WEST CAPE MAY SCHOOL DISTRICT,west cape may boro school dist,west cape may,3417400,31500500800000,94.00000,NA
NJ,West Essex Regional School District,west essex reg sch dist,west essex regional,3417460,31500750100000,1683.00000,NA
NJ,West Long Branch School District,west long branch sch dist,west long branch,3417490,31501304800000,592.00000,NA
NJ,West Milford Township Public School District,west milford twp sch dist,west milford,3417520,31501601300000,3153.00000,school district of the township of west milford
NJ,West Morris Regional High School District,west morris high sch dist,west morris regional,3417550,31501450100000,2426.00000,NA
NJ,WEST NEW YORK SCHOOL DISTRICT,west new york town schools,west new york,3417580,31200901030100,8545.00000,town of west new york board of education
NJ,West Orange Public Schools,west orange town sch dist,west orange public,3417610,31500701400000,6718.00000,NA
NJ,West Windsor-Plainsboro Regional School District,west windsor-plainsboro reg sch dist,west windsor plainsboro regional,3417700,31501101000000,9599.00000,west windsor-plainsboro regional school district
NJ,Westampton Township Public School District,westampton twp sch dist,westampton,3417730,31500303300000,1030.00000,NA
NJ,Westfield Public School District,westfield town sch dist,westfield,3417760,31502001500000,6299.00000,school district of town of westfield
NJ,Westville Boro Public School District,westville boro sch dist,westville boro,3417790,31500802100000,361.00000,NA
NJ,Weymouth Township School District,weymouth twp sch dist,weymouth,3417850,31500100900000,157.00000,NA
NJ,Wharton Borough School District,wharton boro sch dist,wharton,3417880,31501404000000,751.00000,wharton board of education
NJ,White Township Consolidated School District,white twp school district,white consolidated,3417910,31502102200000,278.00000,NA
NJ,Wildwood City School District,wildwood city sch dist,wildwood,3417940,31500590200000,938.00000,city of wildwood board of education
NJ,Wildwood Crest Borough School District,wildwood crest boro sch dist,wildwood crest,3417970,31500501000000,275.00000,NA
NJ,Winfield Township,winfield twp sch dist,winfield,3418030,31502001600000,143.00000,NA
NJ,Wood-Ridge School District,wood-ridge school dist,wood ridge,3418300,31500206800000,1263.00000,NA
NJ,Woodbine School District,woodbine boro sch dist,woodbine,3418090,31500501100000,225.00000,NA
NJ,Woodbury City Public School District,woodbury city sch dist,woodbury,3418150,31500850300000,1637.00000,city of woodbury public school district
NJ,Woodbury Heights Public School District,woodbury heights boro sch dist,woodbury heights,3418180,31500802200000,253.00000,NA
NJ,Woodcliff Lake School District,woodcliff lake school dist,woodcliff lake,3418210,31500206700000,713.00000,NA
NJ,Woodland Township School District,woodland twp sch dist,woodland,3418240,31500303500000,136.00000,NA
NJ,Woodlynne School District,woodlynne boro sch dist,woodlynne,3418270,31500403700000,403.00000,woodlynne board of education
NJ,Wyckoff Township Public School District,wyckoff twp sch dist,wyckoff,3418360,31500206900000,1904.00000,NA
